competition_id,competition_name,parent_id,type,gender,category_id
sr:competition:620,Hopman Cup,NULLABLE,mixed,mixed,sr:category:181
sr:competition:660,World Team Cup,NULLABLE,mixed,men,sr:category:3
sr:competition:990,ATP Challenger Tour Finals,sr:competition:6239,singles,men,sr:category:72
sr:competition:1207,Championship International Series,NULLABLE,singles,women,sr:category:6
sr:competition:2100,Davis Cup,NULLABLE,mixed,men,sr:category:76
sr:competition:2102,Billie Jean King Cup,NULLABLE,mixed,women,sr:category:74
sr:competition:2555,Wimbledon Men Singles,sr:competition:2553,singles,men,sr:category:3
sr:competition:2557,Wimbledon Men Doubles,sr:competition:2553,doubles,men,sr:category:3
sr:competition:2559,Wimbledon Women Singles,sr:competition:2553,singles,women,sr:category:6
sr:competition:2561,Wimbledon Women Doubles,sr:competition:2553,doubles,women,sr:category:6
sr:competition:2563,Wimbledon Mixed Doubles,sr:competition:2553,mixed_doubles,mixed,sr:category:3
sr:competition:2567,Australian Open Men Singles,sr:competition:2565,singles,men,sr:category:3
sr:competition:2569,Australian Open Men Doubles,sr:competition:2565,doubles,men,sr:category:3
sr:competition:2571,Australian Open Women Singles,sr:competition:2565,singles,women,sr:category:6
sr:competition:2573,Australian Open Women Doubles,sr:competition:2565,doubles,women,sr:category:6
sr:competition:2575,Australian Open Mixed Doubles,sr:competition:2565,mixed_doubles,mixed,sr:category:3
sr:competition:2579,French Open Men Singles,sr:competition:2577,singles,men,sr:category:3
sr:competition:2581,French Open Men Doubles,sr:competition:2577,doubles,men,sr:category:3
sr:competition:2583,French Open Women Singles,sr:competition:2577,singles,women,sr:category:6
sr:competition:2585,French Open Women Doubles,sr:competition:2577,doubles,women,sr:category:6
sr:competition:2587,French Open Mixed Doubles,sr:competition:2577,mixed_doubles,mixed,sr:category:3
sr:competition:2591,US Open Men Singles,sr:competition:2589,singles,men,sr:category:3
sr:competition:2593,US Open Men Doubles,sr:competition:2589,doubles,men,sr:category:3
sr:competition:2595,US Open Women Singles,sr:competition:2589,singles,women,sr:category:6
sr:competition:2597,US Open Women Doubles,sr:competition:2589,doubles,women,sr:category:6
sr:competition:2599,US Open Mixed Doubles,sr:competition:2589,mixed_doubles,mixed,sr:category:3
sr:competition:2603,"ATP Doha, Qatar Men Singles",sr:competition:2601,singles,men,sr:category:3
sr:competition:2605,"ATP Doha, Qatar Men Doubles",sr:competition:2601,doubles,men,sr:category:3
sr:competition:2613,"ATP Basel, Switzerland Men Singles",sr:competition:2611,singles,men,sr:category:3
sr:competition:2615,"ATP Basel, Switzerland Men Doubles",sr:competition:2611,doubles,men,sr:category:3
sr:competition:2619,"ATP Brisbane, Australia Men Singles",sr:competition:2617,singles,men,sr:category:3
sr:competition:2621,"ATP Brisbane, Australia Men Doubles",sr:competition:2617,doubles,men,sr:category:3
sr:competition:2625,"ATP Chennai, India Men Singles",sr:competition:2623,singles,men,sr:category:3
sr:competition:2627,"ATP Chennai, India Men Doubles",sr:competition:2623,doubles,men,sr:category:3
sr:competition:2631,"ATP Auckland, New Zealand Men Singles",sr:competition:2629,singles,men,sr:category:3
sr:competition:2633,"ATP Auckland, New Zealand Men Doubles",sr:competition:2629,doubles,men,sr:category:3
sr:competition:2637,"ATP Sydney, Australia Men Singles",sr:competition:2635,singles,men,sr:category:3
sr:competition:2639,"ATP Sydney, Australia Men Doubles",sr:competition:2635,doubles,men,sr:category:3
sr:competition:2649,"ATP Zagreb, Croatia Men Singles",sr:competition:2647,singles,men,sr:category:3
sr:competition:2651,"ATP Zagreb, Croatia Men Double",sr:competition:2647,doubles,men,sr:category:3
sr:competition:2661,"ATP Paris, France Men Singles",sr:competition:2659,singles,men,sr:category:3
sr:competition:2663,"ATP Paris, France Men Doubles",sr:competition:2659,doubles,men,sr:category:3
sr:competition:2667,"ATP Dubai, UAE Men Singles",sr:competition:2665,singles,men,sr:category:3
sr:competition:2669,"ATP Dubai, UAE Men Doubles",sr:competition:2665,doubles,men,sr:category:3
sr:competition:2673,"WTA Pattaya City, Thailand Women Singles",sr:competition:2671,singles,women,sr:category:6
sr:competition:2675,"WTA Pattaya City, Thailand Women Doubles",sr:competition:2671,doubles,women,sr:category:6
sr:competition:2679,"ATP Rotterdam, Netherlands Men Singles",sr:competition:2677,singles,men,sr:category:3
sr:competition:2681,"ATP Rotterdam, Netherlands Men Doubles",sr:competition:2677,doubles,men,sr:category:3
sr:competition:2697,"ATP Memphis, USA Men Singles",sr:competition:2695,singles,men,sr:category:3
sr:competition:2699,"ATP Memphis, USA Men Doubles",sr:competition:2695,doubles,men,sr:category:3
sr:competition:2703,"WTA Bogota, Colombia Women Singles",sr:competition:2701,singles,women,sr:category:6
sr:competition:2705,"WTA Bogota, Colombia Women Doubles",sr:competition:2701,doubles,women,sr:category:6
sr:competition:2709,"ATP Acapulco, Mexico Men Singles",sr:competition:2707,singles,men,sr:category:3
sr:competition:2711,"ATP Acapulco, Mexico Men Doubles",sr:competition:2707,doubles,men,sr:category:3
sr:competition:2715,"WTA Monterrey, Mexico Women Singles",sr:competition:2713,singles,women,sr:category:6
sr:competition:2717,"WTA Monterrey, Mexico Women Doubles",sr:competition:2713,doubles,women,sr:category:6
sr:competition:2721,"ATP Marseille, France Men Singles",sr:competition:2719,singles,men,sr:category:3
sr:competition:2723,"ATP Marseille, France Men Doubles",sr:competition:2719,doubles,men,sr:category:3
sr:competition:2727,"ATP Buenos Aires, Argentina Men Singles",sr:competition:2725,singles,men,sr:category:3
sr:competition:2729,"ATP Buenos Aires, Argentina Men Doubles",sr:competition:2725,doubles,men,sr:category:3
sr:competition:2733,"ATP Delray Beach, USA Men Singles",sr:competition:2731,singles,men,sr:category:3
sr:competition:2735,"ATP Delray Beach, USA Men Doubles",sr:competition:2731,doubles,men,sr:category:3
sr:competition:2739,"ATP Indian Wells, USA Men Singles",sr:competition:2737,singles,men,sr:category:3
sr:competition:2741,"ATP Indian Wells, USA Men Doubles",sr:competition:2737,doubles,men,sr:category:3
sr:competition:2745,"ATP Miami, USA Men Singles",sr:competition:2743,singles,men,sr:category:3
sr:competition:2747,"ATP Miami, USA Men Doubles",sr:competition:2743,doubles,men,sr:category:3
sr:competition:2751,"ATP Houston, USA Men Singles",sr:competition:2749,singles,men,sr:category:3
sr:competition:2753,"ATP Houston, USA Men Doubles",sr:competition:2749,doubles,men,sr:category:3
sr:competition:2757,"ATP Casablanca, Morocco Men Singles",sr:competition:2755,singles,men,sr:category:3
sr:competition:2759,"ATP Casablanca, Morocco Men Doubles",sr:competition:2755,doubles,men,sr:category:3
sr:competition:2763,"WTA Charleston, USA Women Singles",sr:competition:2761,singles,women,sr:category:6
sr:competition:2765,"WTA Charleston, USA Women Doubles",sr:competition:2761,doubles,women,sr:category:6
sr:competition:2769,"ATP Barcelona, Spain Men Singles",sr:competition:2767,singles,men,sr:category:3
sr:competition:2771,"ATP Barcelona, Spain Men Doubles",sr:competition:2767,doubles,men,sr:category:3
sr:competition:2775,"ATP Stuttgart, Germany Men Singles",sr:competition:2773,singles,men,sr:category:3
sr:competition:2777,"ATP Stuttgart, Germany Men Doubles",sr:competition:2773,doubles,men,sr:category:3
sr:competition:2781,"ATP Rome, Italy Men Singles",sr:competition:2779,singles,men,sr:category:3
sr:competition:2783,"ATP Rome, Italy Men Doubles",sr:competition:2779,doubles,men,sr:category:3
sr:competition:2787,"ATP Madrid, Spain Men Singles",sr:competition:2785,singles,men,sr:category:3
sr:competition:2789,"ATP Madrid, Spain Men Doubles",sr:competition:2785,doubles,men,sr:category:3
sr:competition:2793,"Berlin, Germany Women Singles",sr:competition:2791,singles,women,sr:category:6
sr:competition:2795,"Berlin, Germany Women Doubles",sr:competition:2791,doubles,women,sr:category:6
sr:competition:2805,"WTA Hobart, Australia Women Singles",sr:competition:2803,singles,women,sr:category:6
sr:competition:2807,"WTA Hobart, Australia Women Doubles",sr:competition:2803,doubles,women,sr:category:6
sr:competition:2817,"WTA Marrakech, Morocco Women Singles",sr:competition:2815,singles,women,sr:category:6
sr:competition:2819,"WTA Marrakech, Morocco Women Doubles",sr:competition:2815,doubles,women,sr:category:6
sr:competition:2823,"WTA Strasbourg, France Women Singles",sr:competition:2821,singles,women,sr:category:6
sr:competition:2825,"WTA Strasbourg, France Women Doubles",sr:competition:2821,doubles,women,sr:category:6
sr:competition:2829,"ATP Challenger Amersfoort, Netherlands Men Singles",sr:competition:2827,singles,men,sr:category:72
sr:competition:2831,"ATP Challenger Amersfoort, Netherlands Men Doubles",sr:competition:2827,doubles,men,sr:category:72
sr:competition:2835,"ATP Munich, Germany Men Singles",sr:competition:2833,singles,men,sr:category:3
sr:competition:2837,"ATP Munich, Germany Men Doubles",sr:competition:2833,doubles,men,sr:category:3
sr:competition:2853,"WTA Birmingham, Great Britain Women Singles",sr:competition:2851,singles,women,sr:category:6
sr:competition:2855,"WTA Birmingham, Great Britain Women Doubles",sr:competition:2851,doubles,women,sr:category:6
sr:competition:2859,"ATP Halle, Germany Men Singles",sr:competition:2857,singles,men,sr:category:3
sr:competition:2861,"ATP Halle, Germany Men Doubles",sr:competition:2857,doubles,men,sr:category:3
sr:competition:2865,"ATP London, Great Britain Men Singles",sr:competition:2863,singles,men,sr:category:3
sr:competition:2867,"ATP London, Great Britain Men Doubles",sr:competition:2863,doubles,men,sr:category:3
sr:competition:2871,"ATP S-Hertogenbosch, Netherlands Men Singles",sr:competition:2869,singles,men,sr:category:3
sr:competition:2873,"ATP S-Hertogenbosch, Netherlands Men Doubles",sr:competition:2869,doubles,men,sr:category:3
sr:competition:2877,"WTA Eastbourne, Great Britain Women Singles",sr:competition:7629,singles,women,sr:category:6
sr:competition:2879,"WTA Eastbourne, Great Britain Women Doubles",sr:competition:7629,doubles,women,sr:category:6
sr:competition:2883,"ATP Newport, USA Men Singles",sr:competition:2881,singles,men,sr:category:3
sr:competition:2885,"ATP Newport, USA Men Doubles",sr:competition:2881,doubles,men,sr:category:3
sr:competition:2889,"ATP Bastad, Sweden Men Singles",sr:competition:2887,singles,men,sr:category:3
sr:competition:2891,"ATP Bastad, Sweden Men Doubles",sr:competition:2887,doubles,men,sr:category:3
sr:competition:2895,"WTA Budapest, Hungary Women Singles",sr:competition:2893,singles,women,sr:category:6
sr:competition:2897,"WTA Budapest, Hungary Women Doubles",sr:competition:2893,doubles,women,sr:category:6
sr:competition:2901,"WTA Palermo, Italy Women Singles",sr:competition:2899,singles,women,sr:category:6
sr:competition:2903,"WTA Palermo, Italy Women Doubles",sr:competition:2899,doubles,women,sr:category:6
sr:competition:2907,"WTA Prague, Czech Republic Women Singles",sr:competition:2905,singles,women,sr:category:6
sr:competition:2909,"WTA Prague, Czech Republic Women Doubles",sr:competition:2905,doubles,women,sr:category:6
sr:competition:2913,"Portoroz, Slovenia Women Singles",sr:competition:2911,singles,women,sr:category:6
sr:competition:2915,"Portoroz, Slovenia Women Doubles",sr:competition:2911,doubles,women,sr:category:6
sr:competition:2935,"ATP Hamburg, Germany Men Singles",sr:competition:2933,singles,men,sr:category:3
sr:competition:2937,"ATP Hamburg, Germany Men Doubles",sr:competition:2933,doubles,men,sr:category:3
sr:competition:2941,"WTA San Jose, USA Women Singles",sr:competition:2689,singles,women,sr:category:6
sr:competition:2943,"WTA San Jose, USA Women Doubles",sr:competition:2689,doubles,women,sr:category:6
sr:competition:2947,"WTA Istanbul, Turkey Women Singles",sr:competition:2945,singles,women,sr:category:6
sr:competition:2949,"WTA Istanbul, Turkey Women Doubles",sr:competition:2945,doubles,women,sr:category:6
sr:competition:2959,"ATP Gstaad, Switzerland Men Singles",sr:competition:2957,singles,men,sr:category:3
sr:competition:2961,"ATP Gstaad, Switzerland Men Doubles",sr:competition:2957,doubles,men,sr:category:3
sr:competition:2965,"ATP Umag, Croatia Men Singles",sr:competition:2963,singles,men,sr:category:3
sr:competition:2967,"ATP Umag, Croatia Men Doubles",sr:competition:2963,doubles,men,sr:category:3
sr:competition:2971,"ATP Washington, USA Men Singles",sr:competition:2969,singles,men,sr:category:3
sr:competition:2973,"ATP Washington, USA Men Doubles",sr:competition:2969,doubles,men,sr:category:3
sr:competition:2977,"WTA Montreal, Canada Women Singles",sr:competition:2975,singles,women,sr:category:6
sr:competition:2979,"WTA Montreal, Canada Women Doubles",sr:competition:2975,doubles,women,sr:category:6
sr:competition:2983,"ATP Cincinnati, USA Men Singles",sr:competition:2981,singles,men,sr:category:3
sr:competition:2985,"ATP Cincinnati, USA Men Doubles",sr:competition:2981,doubles,men,sr:category:3
sr:competition:2989,"WTA New Haven, USA Women Singles",sr:competition:2987,singles,women,sr:category:6
sr:competition:2991,"WTA New Haven, USA Women Doubles",sr:competition:2987,doubles,women,sr:category:6
sr:competition:2995,"ATP Toronto, Canada Men Singles",sr:competition:2993,singles,men,sr:category:3
sr:competition:2997,"ATP Toronto, Canada Men Doubles",sr:competition:2993,doubles,men,sr:category:3
sr:competition:3001,"ATP Metz, France Men Singles",sr:competition:2999,singles,men,sr:category:3
sr:competition:3003,"ATP Metz, France Men Doubles",sr:competition:2999,doubles,men,sr:category:3
sr:competition:3007,"ATP Bucharest, Romania Men Singles",sr:competition:3005,singles,men,sr:category:3
sr:competition:3009,"ATP Bucharest, Romania Men Doubles",sr:competition:3005,doubles,men,sr:category:3
sr:competition:3013,"WTA Guangzhou, China Women Singles",sr:competition:3011,singles,women,sr:category:6
sr:competition:3015,"WTA Guangzhou, China Women Doubles",sr:competition:3011,doubles,women,sr:category:6
sr:competition:3025,"ATP Beijing, China Men Singles",sr:competition:3023,singles,men,sr:category:3
sr:competition:3027,"ATP Beijing, China Men Doubles",sr:competition:3023,doubles,men,sr:category:3
sr:competition:3031,"ATP Tokyo, Japan Men Singles",sr:competition:3029,singles,men,sr:category:3
sr:competition:3033,"ATP Tokyo, Japan Men Doubles",sr:competition:3029,doubles,men,sr:category:3
sr:competition:3037,"WTA Quebec City, Canada Women Singles",sr:competition:3035,singles,women,sr:category:6
sr:competition:3039,"WTA Quebec City, Canada Women Doubles",sr:competition:3035,doubles,women,sr:category:6
sr:competition:3043,"WTA Seoul, Korea Republic Women Singles",sr:competition:3041,singles,women,sr:category:6
sr:competition:3045,"WTA Seoul, Korea Republic Women Doubles",sr:competition:3041,doubles,women,sr:category:6
sr:competition:3049,"WTA Tashkent, Uzbekistan Women Singles",sr:competition:3047,singles,women,sr:category:6
sr:competition:3051,"WTA Tashkent, Uzbekistan Women Doubles",sr:competition:3047,doubles,women,sr:category:6
sr:competition:3055,"WTA Linz, Austria Women Singles",sr:competition:3053,singles,women,sr:category:6
sr:competition:3057,"WTA Linz, Austria Women Doubles",sr:competition:3053,doubles,women,sr:category:6
sr:competition:3061,"WTA Osaka, Japan Women Singles",sr:competition:3059,singles,women,sr:category:6
sr:competition:3063,"WTA Osaka, Japan Women Doubles",sr:competition:3059,doubles,women,sr:category:6
sr:competition:3067,"ATP Moscow, Russia Men Singles",sr:competition:3065,singles,men,sr:category:3
sr:competition:3069,"ATP Moscow, Russia Men Doubles",sr:competition:3065,doubles,men,sr:category:3
sr:competition:3073,"WTA Luxembourg, Luxembourg Women Singles",sr:competition:3071,singles,women,sr:category:6
sr:competition:3075,"WTA Luxembourg, Luxembourg Women Doubles",sr:competition:3071,doubles,women,sr:category:6
sr:competition:3085,"ATP Shanghai, China Men Singles",sr:competition:3083,singles,men,sr:category:3
sr:competition:3087,"ATP Shanghai, China Men Doubles",sr:competition:3083,doubles,men,sr:category:3
sr:competition:3091,"ATP Stockholm, Sweden Men Singles",sr:competition:3089,singles,men,sr:category:3
sr:competition:3093,"ATP Stockholm, Sweden Men Doubles",sr:competition:3089,doubles,men,sr:category:3
sr:competition:3097,"ATP Lyon, France Men Singles",sr:competition:3095,singles,men,sr:category:3
sr:competition:3099,"ATP Lyon, France Men Doubles",sr:competition:3095,doubles,men,sr:category:3
sr:competition:3103,"ATP Vienna, Austria Men Singles",sr:competition:3101,singles,men,sr:category:3
sr:competition:3105,"ATP Vienna, Austria Men Doubles",sr:competition:3101,doubles,men,sr:category:3
sr:competition:3109,"ATP St. Petersburg, Russia Men Singles",sr:competition:3107,singles,men,sr:category:3
sr:competition:3111,"ATP St. Petersburg, Russia Men Doubles",sr:competition:3107,doubles,men,sr:category:3
sr:competition:3121,"ATP Monte Carlo, Monaco Men Singles",sr:competition:3119,singles,men,sr:category:3
sr:competition:3123,"ATP Monte Carlo, Monaco Men Doubles",sr:competition:3119,doubles,men,sr:category:3
sr:competition:3145,"WTA Antwerp, Belgium Women Singles",sr:competition:3143,singles,women,sr:category:6
sr:competition:3147,"WTA Antwerp, Belgium Women Doubles",sr:competition:3143,doubles,women,sr:category:6
sr:competition:3151,"ATP Kitzbuhel, Austria Men Singles",sr:competition:3149,singles,men,sr:category:3
sr:competition:3153,"ATP Kitzbuhel, Austria Men Doubles",sr:competition:3149,doubles,men,sr:category:3
sr:competition:3163,"San Diego, USA Women Singles",sr:competition:3161,singles,women,sr:category:6
sr:competition:3165,"San Diego, USA Women Doubles",sr:competition:3161,doubles,women,sr:category:6
sr:competition:3181,"ATP Nottingham, Great Britain Men Singles",sr:competition:3179,singles,men,sr:category:3
sr:competition:3183,"ATP Nottingham, Great Britain Men Doubles",sr:competition:3179,doubles,men,sr:category:3
sr:competition:3215,"ATP Challenger Charlottesville, USA Men Doubles",sr:competition:3213,doubles,men,sr:category:72
sr:competition:3217,"ATP Challenger Charlottesville, USA Men Singles",sr:competition:3213,singles,men,sr:category:72
sr:competition:3221,"ATP Challenger Noumea, New Caledonia Men Singles",sr:competition:3219,singles,men,sr:category:72
sr:competition:3223,"ATP Challenger Noumea, New Caledonia Men Doubles",sr:competition:3219,doubles,men,sr:category:72
sr:competition:3227,"ATP Challenger Sao Paulo, Brazil Men Singles",sr:competition:3225,singles,men,sr:category:72
sr:competition:3229,"ATP Challenger Sao Paulo, Brazil Men Doubles",sr:competition:3225,doubles,men,sr:category:72
sr:competition:3233,"ATP Challenger Salinas, Ecuador Men Singles",sr:competition:3231,singles,men,sr:category:72
sr:competition:3235,"ATP Challenger Salinas, Ecuador Men Doubles",sr:competition:3231,doubles,men,sr:category:72
sr:competition:3239,"ATP Santiago, Chile Men Singles",sr:competition:3237,singles,men,sr:category:3
sr:competition:3241,"ATP Santiago, Chile Men Doubles",sr:competition:3237,doubles,men,sr:category:3
sr:competition:3245,"ATP Atlanta, USA Men Singles",sr:competition:3243,singles,men,sr:category:3
sr:competition:3247,"ATP Atlanta, USA Men Doubles",sr:competition:3243,doubles,men,sr:category:3
sr:competition:3251,"ATP Belgrade, Serbia Men Singles",sr:competition:3249,singles,men,sr:category:3
sr:competition:3253,"ATP Belgrade, Serbia Men Doubles",sr:competition:3249,doubles,men,sr:category:3
sr:competition:3257,"ATP Kuala Lumpur, Malaysia Men Singles",sr:competition:3255,singles,men,sr:category:3
sr:competition:3259,"ATP Kuala Lumpur, Malaysia Men Doubles",sr:competition:3255,doubles,men,sr:category:3
sr:competition:3263,"ATP Nice, France Men Singles",sr:competition:3261,singles,men,sr:category:3
sr:competition:3265,"ATP Nice, France Men Doubles",sr:competition:3261,doubles,men,sr:category:3
sr:competition:3281,"ATP Challenger Barletta, Italy Men Singles",sr:competition:3279,singles,men,sr:category:72
sr:competition:3283,"ATP Challenger Barletta, Italy Men Doubles",sr:competition:3279,doubles,men,sr:category:72
sr:competition:3287,"ATP Challenger Bergamo, Italy Men Singles",sr:competition:3285,singles,men,sr:category:72
sr:competition:3289,"ATP Challenger Bergamo, Italy Men Doubles",sr:competition:3285,doubles,men,sr:category:72
sr:competition:3293,"ATP Challenger Floridablanca-Bucaramanga, Colombia Men Singles",sr:competition:3291,singles,men,sr:category:72
sr:competition:3295,"ATP Challenger Floridablanca-Bucaramanga, Colombia Men Doubles",sr:competition:3291,doubles,men,sr:category:72
sr:competition:3299,"ATP Challenger Heilbronn, Germany Men Singles",sr:competition:3297,singles,men,sr:category:72
sr:competition:3301,"ATP Challenger Heilbronn, Germany Men Doubles",sr:competition:3297,doubles,men,sr:category:72
sr:competition:3311,"ATP Challenger Burnie, Australia Men Singles",sr:competition:3309,singles,men,sr:category:72
sr:competition:3313,"ATP Challenger Burnie, Australia Men Doubles",sr:competition:3309,doubles,men,sr:category:72
sr:competition:3321,"ATP Challenger Caltanissetta, Italy Men Singles",sr:competition:3319,singles,men,sr:category:72
sr:competition:3323,"ATP Challenger Caltanissetta, Italy Men Doubles",sr:competition:3319,doubles,men,sr:category:72
sr:competition:3327,"ATP Challenger Cherbourg, France Men Singles",sr:competition:3325,singles,men,sr:category:72
sr:competition:3329,"ATP Challenger Cherbourg, France Men Doubles",sr:competition:3325,doubles,men,sr:category:72
sr:competition:3343,"ATP Challenger Kazan, Russia Men Singles",sr:competition:3341,singles,men,sr:category:72
sr:competition:3345,"ATP Challenger Kazan, Russia Men Doubles",sr:competition:3341,doubles,men,sr:category:72
sr:competition:3349,"ATP Challenger Kyoto, Japan Men Singles",sr:competition:3347,singles,men,sr:category:72
sr:competition:3351,"ATP Challenger Kyoto, Japan Men Doubles",sr:competition:3347,doubles,men,sr:category:72
sr:competition:3367,"ATP Challenger Meknes, Morocco Men Singles",sr:competition:3365,singles,men,sr:category:72
sr:competition:3369,"ATP Challenger Meknes, Morocco Men Doubles",sr:competition:3365,doubles,men,sr:category:72
sr:competition:3379,"ATP Challenger San Luis Potosi, Mexico Men Singles",sr:competition:3377,singles,men,sr:category:72
sr:competition:3381,"ATP Challenger San Luis Potosi, Mexico Men Doubles",sr:competition:3377,doubles,men,sr:category:72
sr:competition:3391,"ATP Challenger St. Brieuc, France Men Singles",sr:competition:3389,singles,men,sr:category:72
sr:competition:3393,"ATP Challenger St. Brieuc, France Men Doubles",sr:competition:3389,doubles,men,sr:category:72
sr:competition:3425,"ATP Challenger Biella, Italy Men Singles",sr:competition:3423,singles,men,sr:category:72
sr:competition:3427,"ATP Challenger Biella, Italy Men Doubles",sr:competition:3423,doubles,men,sr:category:72
sr:competition:3431,"ATP Challenger Blumenau, Brazil Men Singles",sr:competition:3429,singles,men,sr:category:72
sr:competition:3433,"ATP Challenger Blumenau, Brazil Men Doubles",sr:competition:3429,doubles,men,sr:category:72
sr:competition:3437,"ATP Challenger Bordeaux, France Men Singles",sr:competition:3435,singles,men,sr:category:72
sr:competition:3439,"ATP Challenger Bordeaux, France Men Doubles",sr:competition:3435,doubles,men,sr:category:72
sr:competition:3447,"ATP Challenger Busan, Korea Republic Men Singles",sr:competition:3445,singles,men,sr:category:72
sr:competition:3449,"ATP Challenger Busan, Korea Republic Men Doubles",sr:competition:3445,doubles,men,sr:category:72
sr:competition:3453,"ATP Challenger Cairo, Egypt Men Singles",sr:competition:3451,singles,men,sr:category:72
sr:competition:3455,"ATP Challenger Cairo, Egypt Men Doubles",sr:competition:3451,doubles,men,sr:category:72
sr:competition:3469,"ATP Challenger Fergana, Uzbekistan Men Singles",sr:competition:3467,singles,men,sr:category:72
sr:competition:3471,"ATP Challenger Fergana, Uzbekistan Men Doubles",sr:competition:3467,doubles,men,sr:category:72
sr:competition:3475,"ATP Challenger Furth, Germany Men Singles",sr:competition:3473,singles,men,sr:category:72
sr:competition:3477,"ATP Challenger Furth, Germany Men Doubles",sr:competition:3473,doubles,men,sr:category:72
sr:competition:3481,"ATP Challenger Leon, Mexico Men Singles",sr:competition:3479,singles,men,sr:category:72
sr:competition:3483,"ATP Challenger Leon, Mexico Men Doubles",sr:competition:3479,doubles,men,sr:category:72
sr:competition:3493,"ATP Challenger Monza, Italy Men Singles",sr:competition:3491,singles,men,sr:category:72
sr:competition:3495,"ATP Challenger Monza, Italy Men Doubles",sr:competition:3491,doubles,men,sr:category:72
sr:competition:3499,"ATP Challenger Ostrava, Czech Republic Men Singles",sr:competition:3497,singles,men,sr:category:72
sr:competition:3501,"ATP Challenger Ostrava, Czech Republic Men Doubles",sr:competition:3497,doubles,men,sr:category:72
sr:competition:3505,"ATP Challenger Pereira, Colombia Men Singles",sr:competition:3503,singles,men,sr:category:72
sr:competition:3507,"ATP Challenger Pereira, Colombia Men Doubles",sr:competition:3503,doubles,men,sr:category:72
sr:competition:3511,"ATP Challenger Prostejov, Czech Republic Men Singles",sr:competition:3509,singles,men,sr:category:72
sr:competition:3513,"ATP Challenger Prostejov, Czech Republic Men Doubles",sr:competition:3509,doubles,men,sr:category:72
sr:competition:3525,"ATP Challenger San Remo, Italy Men Singles",sr:competition:3523,singles,men,sr:category:72
sr:competition:3529,"ATP Challenger Sarasota, USA Men Singles",sr:competition:3527,singles,men,sr:category:72
