competition_id,competition_name,parent_id,type,gender,category_id
sr:competition:15297,"ITF Italy F12, Men Doubles",sr:competition:17970,doubles,men,sr:category:785
sr:competition:15305,"ITF Hungary 02A, Women Singles",sr:competition:15303,singles,women,sr:category:213
sr:competition:15307,"ITF Hungary 02A, Women Doubles",sr:competition:15303,doubles,women,sr:category:213
sr:competition:15317,"ITF Mexico F1, Men Singles",sr:competition:15315,singles,men,sr:category:785
sr:competition:15319,"ITF Mexico F1, Men Doubles",sr:competition:15315,doubles,men,sr:category:785
sr:competition:15349,"ITF Vietnam F4, Men Singles",sr:competition:15347,singles,men,sr:category:785
sr:competition:15351,"ITF Vietnam F4, Men Doubles",sr:competition:15347,doubles,men,sr:category:785
sr:competition:15355,"ITF Singapore F3, Men Singles",sr:competition:18532,singles,men,sr:category:785
sr:competition:15357,"ITF Singapore F3, Men Doubles",sr:competition:18532,doubles,men,sr:category:785
sr:competition:15361,"ITF Argentina 01A, Women Singles",sr:competition:15359,singles,women,sr:category:213
sr:competition:15363,"ITF Argentina 01A, Women Doubles",sr:competition:15359,doubles,women,sr:category:213
sr:competition:15367,"ITF China 10A, Women Singles",sr:competition:15365,singles,women,sr:category:213
sr:competition:15369,"ITF China 10A, Women Doubles",sr:competition:15365,doubles,women,sr:category:213
sr:competition:15373,"ITF Portugal 04A, Women Singles",sr:competition:15371,singles,women,sr:category:213
sr:competition:15375,"ITF Portugal 04A, Women Doubles",sr:competition:15371,doubles,women,sr:category:213
sr:competition:15387,"ITF Greece F2, Men Singles",sr:competition:16042,singles,men,sr:category:785
sr:competition:15389,"ITF Greece F2, Men Doubles",sr:competition:16042,doubles,men,sr:category:785
sr:competition:15393,"ITF Men San Jose, Costa Rica Men Singles",NULLABLE,singles,men,sr:category:785
sr:competition:15395,"ITF Men San Jose, Costa Rica Men Doubles",NULLABLE,doubles,men,sr:category:785
sr:competition:15399,"Juniors French Open, Paris, France Men Singles",sr:competition:15397,singles,men,sr:category:1474
sr:competition:15401,"Juniors French Open, Paris, France Men Doubles",sr:competition:15397,doubles,men,sr:category:1474
sr:competition:15403,"Juniors French Open, Paris, France Women Singles",sr:competition:15397,singles,women,sr:category:1474
sr:competition:15405,"Juniors French Open, Paris, France Women Doubles",sr:competition:15397,doubles,women,sr:category:1474
sr:competition:15409,"Wheelchairs French Open, Paris, France Men Singles",sr:competition:15407,singles,men,sr:category:1476
sr:competition:15411,"Wheelchairs French Open, Paris, France Men Doubles",sr:competition:15407,doubles,men,sr:category:1476
sr:competition:15413,"Wheelchairs French Open, Paris, France Women Singles",sr:competition:15407,singles,women,sr:category:1476
sr:competition:15415,"Wheelchairs French Open, Paris, France Women Doubles",sr:competition:15407,doubles,women,sr:category:1476
sr:competition:15419,"Legends French Open, Paris, France Men Doubles",sr:competition:15417,doubles,men,sr:category:1475
sr:competition:15421,"Legends French Open, Paris, France Women Doubles",sr:competition:15417,doubles,women,sr:category:1475
sr:competition:15435,"ITF Portugal 05A, Women Singles",sr:competition:15433,singles,women,sr:category:213
sr:competition:15437,"ITF Portugal 05A, Women Doubles",sr:competition:15433,doubles,women,sr:category:213
sr:competition:15452,"ITF Portugal 06A, Women Singles",sr:competition:15450,singles,women,sr:category:213
sr:competition:15454,"ITF Portugal 06A, Women Doubles",sr:competition:15450,doubles,women,sr:category:213
sr:competition:15458,"ITF Czechia 01A, Women Singles",sr:competition:15456,singles,women,sr:category:213
sr:competition:15460,"ITF Czechia 01A, Women Doubles",sr:competition:15456,doubles,women,sr:category:213
sr:competition:15476,"ITF Mexico F21, Men Singles",sr:competition:25099,singles,men,sr:category:785
sr:competition:15478,"ITF Mexico F21, Men Doubles",sr:competition:25099,doubles,men,sr:category:785
sr:competition:15482,"ITF Romania 01A, Women Singles",sr:competition:15480,singles,women,sr:category:213
sr:competition:15484,"ITF Romania 01A, Women Doubles",sr:competition:15480,doubles,women,sr:category:213
sr:competition:15514,"ITF Poland F2, Men Singles",sr:competition:18858,singles,men,sr:category:785
sr:competition:15516,"ITF Poland F2, Men Doubles",sr:competition:18858,doubles,men,sr:category:785
sr:competition:15520,"ITF Hungary 04A, Women Singles",sr:competition:15518,singles,women,sr:category:213
sr:competition:15522,"ITF Hungary 04A, Women Doubles",sr:competition:15518,doubles,women,sr:category:213
sr:competition:15578,"ITF China F10, Men Singles",sr:competition:18920,singles,men,sr:category:785
sr:competition:15580,"ITF China F10, Men Doubles",sr:competition:18920,doubles,men,sr:category:785
sr:competition:15584,"ITF Poland F5, Men Singles",sr:competition:19190,singles,men,sr:category:785
sr:competition:15586,"ITF Poland F5, Men Doubles",sr:competition:19190,doubles,men,sr:category:785
sr:competition:15590,"ITF USA 20A, Women Doubles",sr:competition:15588,doubles,women,sr:category:213
sr:competition:15592,"ITF USA 20A, Women Singles",sr:competition:15588,singles,women,sr:category:213
sr:competition:15596,"ITF Belgium 03A, Women Singles",sr:competition:15594,singles,women,sr:category:213
sr:competition:15598,"ITF Belgium 03A, Women Doubles",sr:competition:15594,doubles,women,sr:category:213
sr:competition:15602,"ITF Sweden 03A, Women Singles",sr:competition:15600,singles,women,sr:category:213
sr:competition:15604,"ITF Sweden 03A, Women Doubles",sr:competition:15600,doubles,women,sr:category:213
sr:competition:15608,"ITF Great Britain 11A, Women Singles",sr:competition:15606,singles,women,sr:category:213
sr:competition:15610,"ITF Great Britain 11A, Women Doubles",sr:competition:15606,doubles,women,sr:category:213
sr:competition:15628,"ATP Challenger Jinan, China Men Singles",sr:competition:15626,singles,men,sr:category:72
sr:competition:15630,"ATP Challenger Jinan, China Men Doubles",sr:competition:15626,doubles,men,sr:category:72
sr:competition:15660,"Juniors Wimbledon, London, GB Women Singles",sr:competition:15658,singles,women,sr:category:1474
sr:competition:15664,"Legends Wimbledon, London, GB Men Doubles",sr:competition:15662,doubles,men,sr:category:1475
sr:competition:15666,"Legends Wimbledon, London, GB Women Doubles",sr:competition:15662,doubles,women,sr:category:1475
sr:competition:15670,"Wheelchairs Wimbledon, London, GB Men Singles",sr:competition:15668,singles,men,sr:category:1476
sr:competition:15672,"Wheelchairs Wimbledon, London, GB Men Doubles",sr:competition:15668,doubles,men,sr:category:1476
sr:competition:15674,"Wheelchairs Wimbledon, London, GB Women Singles",sr:competition:15668,singles,women,sr:category:1476
sr:competition:15676,"Wheelchairs Wimbledon, London, GB Women Doubles",sr:competition:15668,doubles,women,sr:category:1476
sr:competition:15678,"Juniors Wimbledon, London, GB Men Singles",sr:competition:15658,singles,men,sr:category:1474
sr:competition:15680,"Juniors Wimbledon, London, GB Men Doubles",sr:competition:15658,doubles,men,sr:category:1474
sr:competition:15682,"Juniors Wimbledon, London, GB Women Doubles",sr:competition:15658,doubles,women,sr:category:1474
sr:competition:15686,"ITF Portugal F10, Men Singles",sr:competition:19092,singles,men,sr:category:785
sr:competition:15688,"ITF Portugal F10, Men Doubles",sr:competition:19092,doubles,men,sr:category:785
sr:competition:15742,"ITF USA F1, Men Singles",sr:competition:15702,singles,men,sr:category:785
sr:competition:15744,"ITF USA F1, Men Doubles",sr:competition:15702,doubles,men,sr:category:785
sr:competition:15746,"ITF Hong Kong F6, Men Singles",sr:competition:15704,singles,men,sr:category:785
sr:competition:15748,"ITF Hong Kong F6, Men Doubles",sr:competition:15704,doubles,men,sr:category:785
sr:competition:15750,"ITF USA F2, Men Singles",sr:competition:15706,singles,men,sr:category:785
sr:competition:15752,"ITF USA F2, Men Doubles",sr:competition:15706,doubles,men,sr:category:785
sr:competition:15754,"ITF France F1, Men Singles",sr:competition:15708,singles,men,sr:category:785
sr:competition:15756,"ITF France F1, Men Doubles",sr:competition:15708,doubles,men,sr:category:785
sr:competition:15758,"ITF Germany F1, Men Singles",sr:competition:15710,singles,men,sr:category:785
sr:competition:15760,"ITF Germany F1, Men Doubles",sr:competition:15710,doubles,men,sr:category:785
sr:competition:15762,"ITF Tunisia F1, Men Singles",sr:competition:15712,singles,men,sr:category:785
sr:competition:15764,"ITF Tunisia F1, Men Doubles",sr:competition:15712,doubles,men,sr:category:785
sr:competition:15766,"ITF Turkey F1, Men Singles",sr:competition:15714,singles,men,sr:category:785
sr:competition:15768,"ITF Turkey F1, Men Doubles",sr:competition:15714,doubles,men,sr:category:785
sr:competition:15770,"ITF USA F3, Men Singles",sr:competition:15716,singles,men,sr:category:785
sr:competition:15772,"ITF USA F3, Men Doubles",sr:competition:15716,doubles,men,sr:category:785
sr:competition:15774,"ITF Egypt F1, Men Singles",sr:competition:15718,singles,men,sr:category:785
sr:competition:15776,"ITF Egypt F1, Men Doubles",sr:competition:15718,doubles,men,sr:category:785
sr:competition:15778,"ITF France F2, Men Singles",sr:competition:15720,singles,men,sr:category:785
sr:competition:15780,"ITF France F2, Men Doubles",sr:competition:15720,doubles,men,sr:category:785
sr:competition:15782,"ITF Germany F2, Men Singles",sr:competition:15722,singles,men,sr:category:785
sr:competition:15784,"ITF Germany F2, Men Doubles",sr:competition:15722,doubles,men,sr:category:785
sr:competition:15786,"ITF Spain F1, Men Singles",sr:competition:15724,singles,men,sr:category:785
sr:competition:15788,"ITF Spain F1, Men Doubles",sr:competition:15724,doubles,men,sr:category:785
sr:competition:15790,"ITF Tunisia F2, Men Singles",sr:competition:15726,singles,men,sr:category:785
sr:competition:15792,"ITF Tunisia F2, Men Doubles",sr:competition:15726,doubles,men,sr:category:785
sr:competition:15794,"ITF Turkey F2, Men Singles",sr:competition:15728,singles,men,sr:category:785
sr:competition:15796,"ITF Turkey F2, Men Doubles",sr:competition:15728,doubles,men,sr:category:785
sr:competition:15798,"ITF USA F4, Men Singles",sr:competition:15730,singles,men,sr:category:785
sr:competition:15800,"ITF USA F4, Men Doubles",sr:competition:15730,doubles,men,sr:category:785
sr:competition:15802,"ITF Germany F3, Men Singles",sr:competition:15732,singles,men,sr:category:785
sr:competition:15804,"ITF Germany F3, Men Doubles",sr:competition:15732,doubles,men,sr:category:785
sr:competition:15806,"ITF Kazakhstan F1, Men Singles",sr:competition:15734,singles,men,sr:category:785
sr:competition:15808,"ITF Kazakhstan F1, Men Doubles",sr:competition:15734,doubles,men,sr:category:785
sr:competition:15810,"ITF Egypt F2, Men Singles",sr:competition:15736,singles,men,sr:category:785
sr:competition:15812,"ITF Egypt F2, Men Doubles",sr:competition:15736,doubles,men,sr:category:785
sr:competition:15814,"ITF France F3, Men Singles",sr:competition:15738,singles,men,sr:category:785
sr:competition:15816,"ITF France F3, Men Doubles",sr:competition:15738,doubles,men,sr:category:785
sr:competition:15818,"ITF Spain F2, Men Singles",sr:competition:15740,singles,men,sr:category:785
sr:competition:15820,"ITF Spain F2, Men Doubles",sr:competition:15740,doubles,men,sr:category:785
sr:competition:15842,"ITF Tunisia F3, Men Singles",sr:competition:15838,singles,men,sr:category:785
sr:competition:15844,"ITF Tunisia F3, Men Doubles",sr:competition:15838,doubles,men,sr:category:785
sr:competition:15846,"ITF Turkey F3, Men Singles",sr:competition:15840,singles,men,sr:category:785
sr:competition:15848,"ITF Turkey F3, Men Doubles",sr:competition:15840,doubles,men,sr:category:785
sr:competition:15852,"ITF Belgium F4, Men Singles",sr:competition:19152,singles,men,sr:category:785
sr:competition:15854,"ITF Belgium F4, Men Doubles",sr:competition:19152,doubles,men,sr:category:785
sr:competition:15858,"ITF Portugal F11, Men Singles",sr:competition:19192,singles,men,sr:category:785
sr:competition:15860,"ITF Portugal F11, Men Doubles",sr:competition:19192,doubles,men,sr:category:785
sr:competition:15864,"ITF USA F5, Men Singles",sr:competition:15960,singles,men,sr:category:785
sr:competition:15866,"ITF USA F5, Men Doubles",sr:competition:15960,doubles,men,sr:category:785
sr:competition:15872,"ITF Kazakhstan F2, Men Singles",sr:competition:15980,singles,men,sr:category:785
sr:competition:15874,"ITF Kazakhstan F2, Men Doubles",sr:competition:15980,doubles,men,sr:category:785
sr:competition:15876,"ITF Egypt F3, Men Singles",sr:competition:15964,singles,men,sr:category:785
sr:competition:15878,"ITF Egypt F3, Men Doubles",sr:competition:15964,doubles,men,sr:category:785
sr:competition:15950,"ITF Portugal F1, Men Doubles",sr:competition:16124,doubles,men,sr:category:785
sr:competition:15990,"ITF Turkey F4, Men Singles",sr:competition:15972,singles,men,sr:category:785
sr:competition:15992,"ITF USA F6, Men Singles",sr:competition:15974,singles,men,sr:category:785
sr:competition:15994,"ITF Switzerland F1, Men Singles",sr:competition:15886,singles,men,sr:category:785
sr:competition:15996,"ITF Egypt F4, Men Singles",sr:competition:15888,singles,men,sr:category:785
sr:competition:15998,"ITF Great Britain F2, Men Singles",sr:competition:15890,singles,men,sr:category:785
sr:competition:16000,"ITF Indonesia F1, Men Singles",sr:competition:15892,singles,men,sr:category:785
sr:competition:16002,"ITF Spain F4, Men Doubles",sr:competition:15894,doubles,men,sr:category:785
sr:competition:16004,"ITF Tunisia F5, Men Singles",sr:competition:15898,singles,men,sr:category:785
sr:competition:16006,"ITF Turkey F5, Men Singles",sr:competition:15900,singles,men,sr:category:785
sr:competition:16120,"ITF Egypt F7, Men Singles",sr:competition:15946,singles,men,sr:category:785
sr:competition:16126,"ITF Tunisia F8, Men Singles",sr:competition:15952,singles,men,sr:category:785
sr:competition:16128,"ITF Turkey F8, Men Singles",sr:competition:15954,singles,men,sr:category:785
sr:competition:16144,"ITF Great Britain F1, Men Singles",sr:competition:15984,singles,men,sr:category:785
sr:competition:16146,"ITF Great Britain F1, Men Doubles",sr:competition:15984,doubles,men,sr:category:785
sr:competition:16150,"ITF China F13, Men Singles",sr:competition:16148,singles,men,sr:category:785
sr:competition:16152,"ITF China F13, Men Doubles",sr:competition:16148,doubles,men,sr:category:785
sr:competition:16156,"ITF Czech Republic F6, Men Singles",sr:competition:16154,singles,men,sr:category:785
sr:competition:16158,"ITF Czech Republic F6, Men Doubles",sr:competition:16154,doubles,men,sr:category:785
sr:competition:16162,"ITF Germany F8, Men Singles",sr:competition:16160,singles,men,sr:category:785
sr:competition:16164,"ITF Germany F8, Men Doubles",sr:competition:16160,doubles,men,sr:category:785
sr:competition:16168,"ITF Ireland F1, Men Singles",sr:competition:16166,singles,men,sr:category:785
sr:competition:16170,"ITF Ireland F1, Men Doubles",sr:competition:16166,doubles,men,sr:category:785
sr:competition:16174,"ITF Spain F22, Men Singles",sr:competition:16172,singles,men,sr:category:785
sr:competition:16176,"ITF Spain F22, Men Doubles",sr:competition:16172,doubles,men,sr:category:785
sr:competition:16180,"ITF Turkey F26, Men Singles",sr:competition:16178,singles,men,sr:category:785
sr:competition:16182,"ITF Turkey F26, Men Doubles",sr:competition:16178,doubles,men,sr:category:785
sr:competition:16186,"ITF USA F24, Men Singles",sr:competition:16184,singles,men,sr:category:785
sr:competition:16188,"ITF USA F24, Men Doubles",sr:competition:16184,doubles,men,sr:category:785
sr:competition:16192,"ITF Austria F3, Men Singles",sr:competition:16190,singles,men,sr:category:785
sr:competition:16194,"ITF Austria F3, Men Doubles",sr:competition:16190,doubles,men,sr:category:785
sr:competition:16198,"ITF Belgium F5, Men Singles",sr:competition:16196,singles,men,sr:category:785
sr:competition:16200,"ITF Belgium F5, Men Doubles",sr:competition:16196,doubles,men,sr:category:785
sr:competition:16204,"ITF Colombia F1, Men Singles",sr:competition:16202,singles,men,sr:category:785
sr:competition:16206,"ITF Colombia F1, Men Doubles",sr:competition:16202,doubles,men,sr:category:785
sr:competition:16210,"ITF Egypt F21, Men Singles",sr:competition:16208,singles,men,sr:category:785
sr:competition:16212,"ITF Egypt F21, Men Doubles",sr:competition:16208,doubles,men,sr:category:785
sr:competition:16216,"ITF France F16, Men Singles",sr:competition:16214,singles,men,sr:category:785
sr:competition:16218,"ITF France F16, Men Doubles",sr:competition:16214,doubles,men,sr:category:785
sr:competition:16222,"ITF Georgia F3, Men Singles",sr:competition:16220,singles,men,sr:category:785
sr:competition:16224,"ITF Georgia F3, Men Doubles",sr:competition:16220,doubles,men,sr:category:785
sr:competition:16228,"ITF Italy F22, Men Singles",sr:competition:16226,singles,men,sr:category:785
sr:competition:16230,"ITF Italy F22, Men Doubles",sr:competition:16226,doubles,men,sr:category:785
sr:competition:16234,"ITF Lithuania F1, Men Singles",sr:competition:16232,singles,men,sr:category:785
sr:competition:16236,"ITF Lithuania F1, Men Doubles",sr:competition:16232,doubles,men,sr:category:785
sr:competition:16240,"ITF Morocco F1, Men Singles",sr:competition:16238,singles,men,sr:category:785
sr:competition:16242,"ITF Morocco F1, Men Doubles",sr:competition:16238,doubles,men,sr:category:785
sr:competition:16246,"ITF Poland F6, Men Singles",sr:competition:16244,singles,men,sr:category:785
sr:competition:16248,"ITF Poland F6, Men Doubles",sr:competition:16244,doubles,men,sr:category:785
sr:competition:16252,"ITF Portugal F12, Men Singles",sr:competition:16250,singles,men,sr:category:785
sr:competition:16254,"ITF Portugal F12, Men Doubles",sr:competition:16250,doubles,men,sr:category:785
sr:competition:16256,"ITF Spain F3, Men Singles",sr:competition:15986,singles,men,sr:category:785
sr:competition:16258,"ITF Spain F3, Men Doubles",sr:competition:15986,doubles,men,sr:category:785
sr:competition:16260,"ITF Tunisia F4, Men Singles",sr:competition:15970,singles,men,sr:category:785
sr:competition:16262,"ITF Tunisia F4, Men Doubles",sr:competition:15970,doubles,men,sr:category:785
sr:competition:16266,"ITF Kazakhstan 05A, Women Singles",sr:competition:16264,singles,women,sr:category:213
sr:competition:16268,"ITF Kazakhstan 05A, Women Doubles",sr:competition:16264,doubles,women,sr:category:213
sr:competition:16272,"ITF Czech Republic 03A, Women Singles",sr:competition:16270,singles,women,sr:category:213
sr:competition:16274,"ITF Czech Republic 03A, Women Doubles",sr:competition:16270,doubles,women,sr:category:213
sr:competition:16278,"ITF Turkey 28A, Women Singles",sr:competition:16276,singles,women,sr:category:213
sr:competition:16280,"ITF Turkey 28A, Women Doubles",sr:competition:16276,doubles,women,sr:category:213
sr:competition:16284,"ITF USA 22A, Women Singles",sr:competition:16282,singles,women,sr:category:213
sr:competition:16286,"ITF USA 22A, Women Doubles",sr:competition:16282,doubles,women,sr:category:213
sr:competition:16290,"ITF Canada 05A, Women Singles",sr:competition:16288,singles,women,sr:category:213
sr:competition:16292,"ITF Canada 05A, Women Doubles",sr:competition:16288,doubles,women,sr:category:213
sr:competition:16296,"ITF China 14A, Women Singles",sr:competition:16294,singles,women,sr:category:213
sr:competition:16298,"ITF China 14A, Women Doubles",sr:competition:16294,doubles,women,sr:category:213
sr:competition:16302,"ITF Germany 10A, Women Singles",sr:competition:16300,singles,women,sr:category:213
sr:competition:16304,"ITF Germany 10A, Women Doubles",sr:competition:16300,doubles,women,sr:category:213
sr:competition:16308,"ITF Italy 19A, Women Singles",sr:competition:16306,singles,women,sr:category:213
sr:competition:16310,"ITF Italy 19A, Women Doubles",sr:competition:16306,doubles,women,sr:category:213
sr:competition:16314,"ITF Belgium 01A, Women Singles",sr:competition:16312,singles,women,sr:category:213
sr:competition:16316,"ITF Belgium 01A, Women Doubles",sr:competition:16312,doubles,women,sr:category:213
sr:competition:16320,"ITF Egypt 21A, Women Singles",sr:competition:16318,singles,women,sr:category:213
sr:competition:16322,"ITF Egypt 21A, Women Doubles",sr:competition:16318,doubles,women,sr:category:213
sr:competition:16326,"ITF Romania 05A, Women Singles",sr:competition:16324,singles,women,sr:category:213
sr:competition:16328,"ITF Romania 05A, Women Doubles",sr:competition:16324,doubles,women,sr:category:213
sr:competition:16332,"ITF Spain 11A, Women Singles",sr:competition:16330,singles,women,sr:category:213
sr:competition:16334,"ITF Spain 11A, Women Doubles",sr:competition:16330,doubles,women,sr:category:213
sr:competition:16338,"ITF Thailand 05A, Women Singles",sr:competition:16336,singles,women,sr:category:213
sr:competition:16340,"ITF Thailand 05A, Women Doubles",sr:competition:16336,doubles,women,sr:category:213
sr:competition:16454,"ITF China F14, Men Singles",sr:competition:16416,singles,men,sr:category:785
sr:competition:16456,"ITF China F14, Men Doubles",sr:competition:16416,doubles,men,sr:category:785
sr:competition:16458,"ITF France F17, Men Singles",sr:competition:16418,singles,men,sr:category:785
sr:competition:16460,"ITF France F17, Men Doubles",sr:competition:16418,doubles,men,sr:category:785
sr:competition:16462,"ITF Ireland F2, Men Singles",sr:competition:16420,singles,men,sr:category:785
sr:competition:16464,"ITF Ireland F2, Men Doubles",sr:competition:16420,doubles,men,sr:category:785
sr:competition:16466,"ITF Italy F23, Men Singles",sr:competition:16422,singles,men,sr:category:785
sr:competition:16468,"ITF Italy F23, Men Doubles",sr:competition:16422,doubles,men,sr:category:785
sr:competition:16470,"ITF Spain F23, Men Singles",sr:competition:16424,singles,men,sr:category:785
sr:competition:16472,"ITF Spain F23, Men Doubles",sr:competition:16424,doubles,men,sr:category:785
sr:competition:16474,"ITF USA F25, Men Singles",sr:competition:16426,singles,men,sr:category:785
sr:competition:16476,"ITF USA F25, Men Doubles",sr:competition:16426,doubles,men,sr:category:785
sr:competition:16478,"ITF Austria F4, Men Singles",sr:competition:16428,singles,men,sr:category:785
sr:competition:16480,"ITF Austria F4, Men Doubles",sr:competition:16428,doubles,men,sr:category:785
sr:competition:16482,"ITF Belgium F6, Men Singles",sr:competition:16430,singles,men,sr:category:785
sr:competition:16484,"ITF Belgium F6, Men Doubles",sr:competition:16430,doubles,men,sr:category:785
sr:competition:16486,"ITF Colombia F2, Men Singles",sr:competition:16432,singles,men,sr:category:785
sr:competition:16488,"ITF Colombia F2, Men Doubles",sr:competition:16432,doubles,men,sr:category:785
sr:competition:16490,"ITF Egypt F22, Men Singles",sr:competition:16434,singles,men,sr:category:785
sr:competition:16492,"ITF Egypt F22, Men Doubles",sr:competition:16434,doubles,men,sr:category:785
sr:competition:16494,"ITF Estonia F1, Men Singles",sr:competition:16436,singles,men,sr:category:785
sr:competition:16496,"ITF Estonia F1, Men Doubles",sr:competition:16436,doubles,men,sr:category:785
sr:competition:16498,"ITF Macedonia F1, Men Singles",sr:competition:16438,singles,men,sr:category:785
sr:competition:16500,"ITF Macedonia F1, Men Doubles",sr:competition:16438,doubles,men,sr:category:785
sr:competition:16502,"ITF Morocco F2, Men Singles",sr:competition:16440,singles,men,sr:category:785
sr:competition:16504,"ITF Morocco F2, Men Doubles",sr:competition:16440,doubles,men,sr:category:785
sr:competition:16506,"ITF Poland F7, Men Singles",sr:competition:16442,singles,men,sr:category:785
sr:competition:16508,"ITF Poland F7, Men Doubles",sr:competition:16442,doubles,men,sr:category:785
sr:competition:16510,"ITF Portugal F13, Men Singles",sr:competition:16444,singles,men,sr:category:785
sr:competition:16512,"ITF Portugal F13, Men Doubles",sr:competition:16444,doubles,men,sr:category:785
sr:competition:16514,"ITF Romania F7, Men Singles",sr:competition:16446,singles,men,sr:category:785
sr:competition:16516,"ITF Romania F7, Men Doubles",sr:competition:16446,doubles,men,sr:category:785
sr:competition:16518,"ITF Russia F4, Men Singles",sr:competition:16448,singles,men,sr:category:785
sr:competition:16520,"ITF Russia F4, Men Doubles",sr:competition:16448,doubles,men,sr:category:785
sr:competition:16522,"ITF Slovakia F1, Men Singles",sr:competition:16450,singles,men,sr:category:785
sr:competition:16524,"ITF Slovakia F1, Men Doubles",sr:competition:16450,doubles,men,sr:category:785
sr:competition:16526,"ITF Turkiye F27, Men Singles",sr:competition:16452,singles,men,sr:category:785
sr:competition:16528,"ITF Turkiye F27, Men Doubles",sr:competition:16452,doubles,men,sr:category:785
sr:competition:16566,"ITF Czechia 04A, Women Singles",sr:competition:16536,singles,women,sr:category:213
sr:competition:16568,"ITF Czechia 04A, Women Doubles",sr:competition:16536,doubles,women,sr:category:213
sr:competition:16570,"ITF Canada 06A, Women Singles",sr:competition:16538,singles,women,sr:category:213
sr:competition:16572,"ITF Canada 06A, Women Doubles",sr:competition:16538,doubles,women,sr:category:213
sr:competition:16574,"ITF USA 26A, Women Singles",sr:competition:16540,singles,women,sr:category:213
sr:competition:16576,"ITF USA 26A, Women Doubles",sr:competition:16540,doubles,women,sr:category:213
sr:competition:16578,"ITF Germany 11A, Women Singles",sr:competition:16542,singles,women,sr:category:213
